{
  "schemaVersion": 1,
  "policyVersion": "v1.0.0",
  "note": "说人话关的唯一配置真源。三件事写在一起：哪些文字必须过这道关、哪些明确豁免、以及一份不许再出现的词的名单。判据由维护者定：一个没读过本仓任何文件的人，能不能一遍读懂。",
  "mustPass": [
    {
      "id": "acceptance-record",
      "displayName": "验收记录",
      "changePathPatterns": [
        "08-验收/验收记录.md"
      ],
      "reason": "验收记录是维护者在验收门要读的东西，也是事后唯一能复核当时结论的文字。"
    },
    {
      "id": "spec-delta",
      "displayName": "长期规范增量",
      "changePathPatterns": [
        "specs/**/*.md"
      ],
      "reason": "长期规范会被合入 openspec/specs 并长期存在，读它的人不会有本次改动的上下文。"
    }
  ],
  "repoMustPass": [
    {
      "id": "readme-and-docs",
      "displayName": "README 与说明文档",
      "repoPathPatterns": [
        "README.md",
        "docs/**/*.md"
      ],
      "reason": "说明文档的读者按定义就是不熟悉本仓的人。"
    },
    {
      "id": "long-term-specs",
      "displayName": "长期规范",
      "repoPathPatterns": [
        "openspec/specs/**/*.md"
      ],
      "reason": "同 spec-delta，合入之后依然要被没有上下文的人读。"
    }
  ],
  "manualMustPass": [
    {
      "id": "pull-request",
      "displayName": "PR 的正文与标题",
      "reason": "PR 正文没有落盘位置，机器扫不到；由 agent 在开 PR 前用 plain-language 子命令显式扫一遍，扫描结果计入审读记录。"
    },
    {
      "id": "direction-level-intake",
      "displayName": "方向级事项记录",
      "reason": "openspec/intake 下记录方向性裁决的那几份。哪些算方向级需要人判断，机器无法按路径区分，故列为手动项。"
    }
  ],
  "exempt": [
    {
      "id": "machine-format",
      "displayName": "机器格式文件",
      "changePathPatterns": [
        "**/*.json",
        "**/*.yaml",
        "**/*.yml",
        "**/*.log",
        "**/*.txt"
      ],
      "reason": "JSON、状态文件、契约不是写给人读的连续文字，逐词审读只会制造噪音。"
    },
    {
      "id": "routine-trace",
      "displayName": "例行过程留痕",
      "changePathPatterns": [
        "07-实施任务/**",
        "08-验收/runs/**",
        "09-发布/**"
      ],
      "reason": "只有 agent 自己读的中间产物，没有第二个读者，审读它等于给自己写作业。"
    }
  ],
  "bannedWords": [
    {
      "word": "砍纸",
      "replacement": "精简工件",
      "reason": "agent 自造的词，维护者不认得。",
      "addedAt": "2026-09-01"
    },
    {
      "word": "台账",
      "replacement": "事项记录",
      "reason": "维护者明确表示不喜欢这个词。",
      "addedAt": "2026-09-01"
    }
  ],
  "bannedWordsPolicy": "只作用于今后产出的人读文字，不回溯扫描存量文件。名单只增不减：维护者每嫌弃一个词就加一条，每条必须同时给出替代词与理由——没有替代词的禁令会让人不知道该怎么写。"
}
